{
  "schemaVersion": "1.1.0",
  "metadata": {
    "benchmarkVersion": "specforge-fsi-v1.0.0",
    "generatedAt": "2026-08-18T15:09:47.419Z",
    "dataKind": "measured",
    "evidenceQualification": {
      "level": "bounded-measured",
      "limitation": "GitHub Copilot exposes the selected model IDs but not immutable provider model build IDs. Results are measured and reproducible at the disclosed Copilot model-selection and agent-version boundary, not at an underlying provider-build boundary."
    },
    "repetitionsPerLane": 3,
    "pricingAsOf": null,
    "rateType": "unavailable",
    "frozenInputs": {
      "freezeRecordSha256": "edd523966c35daa42a6ad2306670157c90336232bac20b3c6f3e88c27a66ef30",
      "evaluatorSha256": "1540f263481cae49fa84bc8d187c5e1b503cc5775f41f24da1e54339870c8946",
      "scoringConfigSha256": "c9e7c3bebd575b3b56f0409d69cdb5d952c175a73ec11ada7599d73a9648bac6",
      "costsConfigSha256": "3b2c5ed227eef9cb46c8686dca1bd76af97e2f50e36729358ebc7c9d00dc5ea5",
      "benchmarkEngineSha256": "848140d8340397b49926e4b1a05cca6a873850ee2822eb8ad8d654e3078dab9a",
      "promptSha256s": [
        "f22d3d71127ff9f1e7c3e35706442e5d4a79443ef273fa28e43468c0dc789957",
        "518d8bb000fd36bb982c37042636adf1f54c0d1a484ba5319578ec858452db23",
        "f47aa4cd40324a29be02f62a6f7fb8c900a72017ad565ca3b3e7756e343d648d",
        "b4a29ff8f3be258bdb86f51d78760adf86cd8319cd1a1051c7dd7216b10724f4"
      ],
      "experimentConfigSha256": "b7f2dd0b8a5990a4264412829ede8e05fcb0a20fd7814cba902a01ac54f3276f",
      "runSchemaSha256": "b4cc4103ec2613d7f6ce46aef274a32b4e58a63cebeaccefc609f645606ccf11",
      "reportSchemaSha256": "b1b050eba32e96cb059d542ea21114e7d91d8e88cc22f74bc9b867be45187204",
      "claimRule": {
        "comparisonLane": "efficient-spec",
        "controlLane": "frontier-raw",
        "equivalentWithinPoints": 3,
        "betterByMoreThanPoints": 3,
        "aggregation": "marginal-medians",
        "requireAllHardGates": true,
        "comparisonLaneGatesDetermineEligibility": true,
        "controlLaneGateFailuresAreReportedSeparately": true,
        "inconclusiveWhenDeltaWithinObservedLaneSpread": true,
        "overallRollup": "weaker-episode",
        "qualityAndEfficiencyVerdictsAreSeparate": true,
        "notes": "Quality is worse only when comparison median minus control median is below negative equivalentWithinPoints."
      }
    },
    "frozenVersions": [
      "baseline:modernization:refs/tags/benchmark-legacy-v1@b020630048cd90a039fb4f13e437c900b6cd4eac",
      "baseline:audit-feature:refs/tags/benchmark-modernized-v1@806344ba17e194b54d0e645455829ab05c58fb6c",
      "model:mai-code-1.1-flash:not-exposed-by-copilot;agent:1.0.79-9/not-separately-exposed-by-copilot;reasoning:high",
      "model:claude-opus-5:not-exposed-by-copilot;agent:1.0.79-9/not-separately-exposed-by-copilot;reasoning:high"
    ]
  },
  "overallClaim": {
    "status": "not-supported",
    "qualityVerdict": "indeterminate",
    "efficiencyVerdict": "unavailable",
    "drivingMetric": "unavailable",
    "qualityDelta": -85,
    "costSavingPercent": null,
    "message": "Overall claim status is \"not-supported\", the weaker of 2 per-episode claims (never an average). [modernization: not-supported, quality=indeterminate, efficiency=unavailable] [audit-feature: not-supported, quality=indeterminate, efficiency=unavailable] Driving episode for the headline numbers below: \"modernization\" (Episode \"modernization\": claim not supported -- not every run in the comparison lane \"efficient-spec\" passed all applicable hard gates. Comparison lane hard gates: 0/3 runs passed all applicable gates. Control lane hard gates (visible, non-blocking): 3/3 runs passed.) Monetary cost and token evidence are unavailable, so no efficiency advantage is claimed."
  },
  "episodes": [
    {
      "id": "modernization",
      "name": "Platform modernization",
      "claim": {
        "status": "not-supported",
        "qualityVerdict": "indeterminate",
        "efficiencyVerdict": "unavailable",
        "drivingMetric": "unavailable",
        "qualityDelta": -85,
        "costSavingPercent": null,
        "message": "Episode \"modernization\": claim not supported -- not every run in the comparison lane \"efficient-spec\" passed all applicable hard gates. Comparison lane hard gates: 0/3 runs passed all applicable gates. Control lane hard gates (visible, non-blocking): 3/3 runs passed."
      },
      "laneSummaries": [
        {
          "laneId": "efficient-raw",
          "modelDisplayName": "MAI Code 1.1 Flash",
          "inputMode": "raw",
          "qualityMedian": 0,
          "qualityMin": 0,
          "qualityMax": 0,
          "hardGatePassCount": 0,
          "hardGateFailCount": 3,
          "runCount": 3,
          "elapsedMedianSeconds": 5400,
          "productiveMedianSeconds": 1032.394,
          "tokenMedian": 9749862,
          "costMedianUsd": null
        },
        {
          "laneId": "efficient-spec",
          "modelDisplayName": "MAI Code 1.1 Flash",
          "inputMode": "spec",
          "qualityMedian": 15,
          "qualityMin": 0,
          "qualityMax": 15,
          "hardGatePassCount": 0,
          "hardGateFailCount": 3,
          "runCount": 3,
          "elapsedMedianSeconds": 5198.503,
          "productiveMedianSeconds": 1196.877,
          "tokenMedian": 10591063,
          "costMedianUsd": null
        },
        {
          "laneId": "frontier-raw",
          "modelDisplayName": "Claude Opus 5",
          "inputMode": "raw",
          "qualityMedian": 100,
          "qualityMin": 100,
          "qualityMax": 100,
          "hardGatePassCount": 3,
          "hardGateFailCount": 0,
          "runCount": 3,
          "elapsedMedianSeconds": 5350.903,
          "productiveMedianSeconds": 1659.694,
          "tokenMedian": 11618120,
          "costMedianUsd": null
        },
        {
          "laneId": "frontier-spec",
          "modelDisplayName": "Claude Opus 5",
          "inputMode": "spec",
          "qualityMedian": 100,
          "qualityMin": 100,
          "qualityMax": 100,
          "hardGatePassCount": 3,
          "hardGateFailCount": 0,
          "runCount": 3,
          "elapsedMedianSeconds": 4514.63,
          "productiveMedianSeconds": 1403.603,
          "tokenMedian": 9400538,
          "costMedianUsd": null
        }
      ],
      "runs": [
        {
          "runId": "modernization-efficient-raw-r1",
          "dataKind": "measured",
          "laneId": "efficient-raw",
          "modelDisplayName": "MAI Code 1.1 Flash",
          "inputMode": "raw",
          "repetition": 1,
          "status": "timed-out",
          "qualityScore": 0,
          "hardGates": [
            {
              "id": "build",
              "applicable": true,
              "status": "failed",
              "reason": null
            },
            {
              "id": "essential-business-invariants",
              "applicable": true,
              "status": "failed",
              "reason": null
            },
            {
              "id": "no-critical-security-findings",
              "applicable": true,
              "status": "failed",
              "reason": null
            },
            {
              "id": "maker-checker-separation",
              "applicable": false,
              "status": "not-applicable",
              "reason": null
            },
            {
              "id": "audit-integrity",
              "applicable": false,
              "status": "not-applicable",
              "reason": null
            }
          ],
          "hardGatesPassed": false,
          "scores": {
            "behaviorPreservation": 0,
            "functionalCorrectness": 0,
            "maintainability": 100,
            "operability": 0,
            "scopeTraceability": 0,
            "securityControls": 0
          },
          "elapsedSeconds": 5400,
          "productiveSeconds": 1000.246,
          "queueSeconds": 13.409,
          "toolCalls": 128,
          "inputTokens": 615576,
          "cachedInputTokens": 7106816,
          "outputTokens": 71312,
          "reasoningTokens": 44480,
          "estimatedCostUsd": null,
          "specAuthoringAmortizedCostUsd": null,
          "specAuthoringAmortizedTokens": 0,
          "evidencePath": "evidence/measured/runs/modernization-efficient-raw-r1/evidence"
        },
        {
          "runId": "modernization-efficient-raw-r2",
          "dataKind": "measured",
          "laneId": "efficient-raw",
          "modelDisplayName": "MAI Code 1.1 Flash",
          "inputMode": "raw",
          "repetition": 2,
          "status": "timed-out",
          "qualityScore": 0,
          "hardGates": [
            {
              "id": "build",
              "applicable": true,
              "status": "failed",
              "reason": null
            },
            {
              "id": "essential-business-invariants",
              "applicable": true,
              "status": "failed",
              "reason": null
            },
            {
              "id": "no-critical-security-findings",
              "applicable": true,
              "status": "failed",
              "reason": null
            },
            {
              "id": "maker-checker-separation",
              "applicable": false,
              "status": "not-applicable",
              "reason": null
            },
            {
              "id": "audit-integrity",
              "applicable": false,
              "status": "not-applicable",
              "reason": null
            }
          ],
          "hardGatesPassed": false,
          "scores": {
            "behaviorPreservation": 0,
            "functionalCorrectness": 0,
            "maintainability": 100,
            "operability": 0,
            "scopeTraceability": 0,
            "securityControls": 0
          },
          "elapsedSeconds": 5400,
          "productiveSeconds": 1302.725,